{
  "format": "lunarsim-story",
  "version": 1,
  "id": "pads-distance",
  "title": "How far should the pads be?",
  "status": "published",
  "summary": "The wait of urgent cargo grows by {{r:standoff_pct}} of distance between the landing pads and the base, but close pads spray the base with ejecta.",
  "scene": "world:P2",
  "notes": "E20 pooled law at the typical fleet load (results/table_E20.csv) and the E20 siting model (results/E20_fit.json). Wording for LEAD to edit.",
  "numbers": {
    "standoff_pct": {"table": "results/table_E20.csv", "where": {"response": "log_delay_prio1_mean_h", "subset": "pooled", "term": "standoff"}, "column": "pct_per_unit", "digits": 1, "unit": "% per km", "note": "pooled fit of ln(urgent mean delay), 100 (e^b - 1) per km of pad standoff, at the typical fleet load (experiment E20)"},
    "standoff_lo": {"table": "results/table_E20.csv", "where": {"response": "log_delay_prio1_mean_h", "subset": "pooled", "term": "standoff"}, "column": "ci_lo", "transform": "exp_pct", "digits": 1, "unit": "%", "note": "lower end of the 95 % bootstrap interval over seeds"},
    "standoff_hi": {"table": "results/table_E20.csv", "where": {"response": "log_delay_prio1_mean_h", "subset": "pooled", "term": "standoff"}, "column": "ci_hi", "transform": "exp_pct", "digits": 1, "unit": "%", "note": "upper end of the 95 % bootstrap interval over seeds"},
    "fit_years": {"table": "results/table_E20.csv", "where": {"response": "log_delay_prio1_mean_h", "subset": "pooled", "term": "standoff"}, "column": "n", "digits": 0, "unit": "simulated years", "note": "rows of the pooled fit: one seed of one cell each (E17 + E18)"},
    "fit_seeds": {"table": "results/table_E20.csv", "where": {"response": "log_delay_prio1_mean_h", "subset": "pooled", "term": "standoff"}, "column": "n_seeds", "digits": 0, "unit": "seeds"},
    "keepout_pct": {"table": "results/table_E20.csv", "where": {"response": "log_delay_prio1_mean_h", "subset": "pooled", "term": "keepout"}, "column": "pct_per_unit", "digits": 1, "unit": "% per km", "note": "per km of plume keep-out radius"},
    "keepout_lo": {"table": "results/table_E20.csv", "where": {"response": "log_delay_prio1_mean_h", "subset": "pooled", "term": "keepout"}, "column": "ci_lo", "transform": "exp_pct", "digits": 1, "unit": "%", "note": "95 % bootstrap interval, lower end"},
    "keepout_hi": {"table": "results/table_E20.csv", "where": {"response": "log_delay_prio1_mean_h", "subset": "pooled", "term": "keepout"}, "column": "ci_hi", "transform": "exp_pct", "digits": 1, "unit": "%", "note": "95 % bootstrap interval, upper end"},
    "miss_pct": {"table": "results/table_E20.csv", "where": {"response": "log_delay_prio1_mean_h", "subset": "pooled", "term": "log_miss"}, "column": "pct_per_unit", "digits": 1, "unit": "%", "note": "per e-fold of the mean landing miss"},
    "impacts_near": {"json": "results/E20_fit.json", "path": ["siting", "impacts_per_landing_at_standoffs", "0.5"], "digits": 0, "unit": "", "note": "ejecta impacts on the base per landing at a 0.5 km standoff, Modelled from the Wittal et al. (2022) anchors"},
    "impacts_far": {"json": "results/E20_fit.json", "path": ["siting", "impacts_per_landing_at_standoffs", "5"], "digits": 2, "unit": "", "note": "the same at a 5 km standoff"},
    "far_cheapest": {"json": "results/E20_fit.json", "path": ["siting", "share_of_minima_by_standoff", 13, "share_min_at_5km"], "scale": 100, "digits": 0, "unit": "%", "flag": "Assumed", "note": "share of the fleet and dispatch cells whose cheapest standoff is 5 km, at energy 500 $/kWh, damage 1 M$ per impact, delay valued at 100 $ per item-hour (prices Assumed)"}
  },
  "steps": [
    {
      "id": "law",
      "title": "Every kilometre costs time",
      "text": "Rovers carry each delivery from the pads to the base. The mean wait of urgent cargo grows by {{r:standoff_pct}} of standoff, with an interval of {{r:standoff_lo}} to {{r:standoff_hi}}.",
      "visual": "The base and its two landing pads, with the rover routes between them drawn on the ground.",
      "camera": {"shot": "pads"},
      "highlight": ["PAD_A", "PAD_B", "BASE"],
      "modes": {"routes": true},
      "chips": ["standoff_pct"]
    },
    {
      "id": "evidence",
      "title": "Where the law comes from",
      "text": "One fit over {{r:fit_years}} from {{r:fit_seeds}}: every fleet size, job rule, landing accuracy and pad size of the study.",
      "visual": "The whole base from above, rovers driving between pads, depot and work sites.",
      "camera": {"shot": "overview"},
      "modes": {"play": true},
      "chips": ["fit_years"]
    },
    {
      "id": "keepout",
      "title": "Keep-out zones barely matter",
      "text": "Clearing a plume keep-out zone during each landing changes the wait by {{r:keepout_pct}} of keep-out radius, an interval of {{r:keepout_lo}} to {{r:keepout_hi}} that includes zero. The fleets are idle most of the time and absorb the evacuations.",
      "visual": "A ring around the active pad marks the plume keep-out zone; rovers wait outside it until the lander is down.",
      "camera": {"shot": "pads", "target": "PAD_A"},
      "highlight": ["PAD_A"],
      "modes": {"keepout": true},
      "chips": ["keepout_pct"]
    },
    {
      "id": "accuracy",
      "title": "Landing accuracy acts through the pad edge",
      "text": "Each e-fold of the mean landing miss adds {{r:miss_pct}}, because landings off the pad mean longer, rougher drives.",
      "visual": "Touchdown points scattered around the pad; the ones outside its rim are highlighted.",
      "camera": {"shot": "pads", "target": "PAD_A"},
      "highlight": ["PAD_A"],
      "modes": {"touchdowns": true},
      "chips": ["miss_pct"]
    },
    {
      "id": "ejecta",
      "scene": "world:P2-pads-0.5km",
      "title": "Close pads spray the base",
      "text": "A landing blasts regolith outward. At the nearest standoff studied the model expects about {{r:impacts_near}} ejecta impacts on the base per landing; at the farthest, {{r:impacts_far}}.",
      "visual": "The ejecta fan from a landing on the near pad reaching the base buildings.",
      "camera": {"shot": "base"},
      "highlight": ["BASE", "PAD_A"],
      "modes": {"ejecta": true},
      "chips": ["impacts_near", "impacts_far"]
    },
    {
      "id": "answer",
      "scene": "world:P2-pads-3km",
      "title": "So: far, unless energy is dear",
      "text": "Pricing hauling, ejecta damage and waiting time together, the farthest standoff studied is cheapest in {{r:far_cheapest}} of the cells at middle prices. Only cheap damage, together with dear energy or highly valued time, pulls the pads closer.",
      "visual": "The base from a distance, with the pads at the far end of their routes.",
      "camera": {"shot": "overview"},
      "highlight": ["PAD_A", "PAD_B"],
      "chips": ["far_cheapest"]
    }
  ]
}
